,SKU,Type,Description,Cost,Quantity (g),Vegan/Non-Vegan,Gluten-Free/Non-Gluten-Free
164,Hillshire Farm Turkey Breast,Meat - Poultry,"Hillshire Farm Turkey Breast is a delicious and tender deli meat made from 100% premium turkey breast. Sliced thinly for convenience, this high-quality poultry product is perfect for sandwiches, salads, and snacking. It is seasoned with a blend of herbs and spices for a flavorful and satisfying taste. Enjoy the natural goodness of turkey with Hillshire Farm Turkey Breast.",$1.64,528,Non-Vegan,Gluten-Free
165,Maple Leaf Farms Duck Breast,Meat - Poultry,"Maple Leaf Farms Duck Breast is a premium poultry product known for its rich and flavorful taste. This tender and juicy duck breast is carefully raised and expertly prepared to ensure the highest quality. Perfect for grilling, roasting, or pan-searing, it is an excellent choice for those looking to elevate their poultry dishes and enjoy a delicious, gourmet dining experience.",$4.75,676,Non-Vegan,Non-Gluten-Free
166,Jennie-O Ground Turkey,Meat - Poultry,"Jennie-O Ground Turkey is a lean and versatile poultry product perfect for creating healthier meals. Made from 100% turkey, it is a great alternative to traditional ground beef and can be used in a wide variety of recipes, from tacos and burgers to meatloaf and pasta dishes. With its delicious flavor and low fat content, Jennie-O Ground Turkey is a nutritious choice for anyone looking to reduce their red meat intake without compromising on taste.",$3.00,573,Non-Vegan,Non-Gluten-Free
167,Empire Kosher Whole Chicken,Meat - Poultry,"Empire Kosher Whole Chicken is a high-quality poultry product that is carefully raised and processed to meet the highest standard of kosher preparation. This whole chicken is plump, juicy, and flavorful, making it the perfect centerpiece for any meal. Whether roasted, grilled, or fried, this chicken is sure to be a delicious addition to your family's dinner table.",$4.26,490,Vegan,Non-Gluten-Free
168,Butterball Turkey Drumsticks,Meat - Poultry,"Butterball Turkey Drumsticks are juicy and flavorful cuts of meat that are perfect for a variety of recipes. These lean and tender drumsticks are a great choice for grilling, roasting, or frying, and are versatile enough to be used in everything from soups and stews to salads and sandwiches. Whether you're cooking for a weeknight dinner or a special occasion, Butterball Turkey Drumsticks are a delicious and convenient option that the whole family will love.",$3.78,284,Vegan,Non-Gluten-Free
169,Murray's Chicken Wings,Meat - Poultry,"Murray's Chicken Wings are made from premium, all-natural chicken raised on family-owned farms. These juicy and flavorful wings are perfect for grilling, frying, or baking, and they are sure to be a hit at any party or gathering. With no added hormones or antibiotics, Murray's Chicken Wings offer a delicious and wholesome option for poultry lovers.",$4.89,474,Non-Vegan,Gluten-Free
170,Angus Beef,Meat - Beef,"Angus Beef is a premium meat product known for its marbling, tenderness, and rich flavor. Sourced from Angus cattle, this high-quality beef is perfect for grilling, roasting, or braising, and is a versatile option for any meat lover. Whether used in a steak, burger, or stew, Angus Beef offers a delicious and satisfying dining experience.",$3.87,345,Non-Vegan,Gluten-Free
171,Grass-fed Beef,Meat - Beef,"Grass-fed Beef is a premium meat product sourced from cattle that have been raised on a diet of grass and forage. This natural and sustainable farming practice results in a lean and tender beef with a rich, earthy flavor. Enjoy the superior taste and quality of Grass-fed Beef in your favorite recipes.",$3.76,195,Vegan,Gluten-Free
172,Ribeye Steak,Meat - Beef,"Ribeye Steak is a premium cut of beef known for its rich marbling and juicy, tender texture. It is prized for its intense flavor and luxurious mouthfeel, making it a popular choice for steak lovers. Whether grilled, pan-seared, or broiled, Ribeye Steak is a indulgent and satisfying choice for any meat enthusiast.",$1.97,107,Vegan,Gluten-Free
173,Ground Beef,Meat - Beef,"Ground beef is a versatile and delicious meat product made from finely ground beef. It is perfect for creating a wide variety of savory dishes, from juicy burgers and meatballs to hearty pasta sauces and chili. With its rich flavor and high protein content, ground beef is a popular choice for home cooks and professional chefs alike.",$2.84,687,Non-Vegan,Non-Gluten-Free
174,Sirloin Steak,Meat - Beef,"""Sirloin Steak"" is a premium cut of beef known for its rich, savory flavor and tender, juicy texture. This top-quality meat is carefully sourced and expertly prepared, making it a popular choice for grilling, broiling, or pan-searing. Whether served as a standalone entrée or incorporated into a variety of recipes, Sirloin Steak is sure to impress with its robust taste and fine marbling.",$4.32,452,Non-Vegan,Gluten-Free
175,Beef Tenderloin,Meat - Beef,"Beef Tenderloin is a premium cut of beef known for its exceptional tenderness and rich flavor. This lean and succulent meat is perfect for grilling, pan-searing, or roasting, making it a versatile option for any culinary creation. Whether it's a special occasion or a simple weekday meal, Beef Tenderloin is sure to impress with its quality and exquisite taste.",$2.13,282,Vegan,Gluten-Free
176,Beef Chuck,Meat - Beef,"Beef Chuck is a classic cut of beef known for its rich flavor and tenderness. This product is perfect for slow-cooking or braising, as it becomes incredibly juicy and succulent when cooked low and slow. Whether used for stews, roasts, or shredded for sandwiches, Beef Chuck is a versatile and flavorful choice for any beef lover.",$4.98,952,Non-Vegan,Gluten-Free
177,Beef Ribs,Meat - Beef,"Beef Ribs are succulent and flavorful cuts of meat that come from the rib section of the cow. Known for their rich, juicy flavor and tender texture, these ribs are perfect for grilling, smoking, or slow-cooking. Whether enjoyed as a hearty main course or added to soups and stews for added depth of flavor, beef ribs are a delicious and satisfying choice for any meal.",$1.20,993,Non-Vegan,Gluten-Free
178,Beef Brisket,Meat - Beef,"Beef Brisket is a rich and flavorful cut of beef, perfect for slow cooking and smoking. This tender and juicy meat is known for its delicious, savory flavor and is a staple in barbecue and comfort food dishes. It is a versatile cut that can be used in a variety of recipes, from traditional braised dishes to mouthwatering sandwiches. Whether it's roasted, smoked, or braised, Beef Brisket is sure to satisfy your meat cravings.",$2.48,748,Non-Vegan,Gluten-Free
179,Beef Strip Loin,Meat - Beef,"Beef Strip Loin is a premium cut of meat that is known for its tender, juicy texture and rich, beefy flavor. Perfect for grilling or roasting, this highly marbled strip loin offers a delicious dining experience with every bite. Whether it's for a special occasion or a casual weeknight meal, Beef Strip Loin is a versatile and mouthwatering choice for beef lovers.",$1.30,805,Non-Vegan,Non-Gluten-Free
180,Smithfield Prime Fresh Pork Tenderloin,Meat - Pork,"Smithfield Prime Fresh Pork Tenderloin is a high-quality, flavorful cut of pork that is perfect for any dish. This tenderloin is expertly trimmed and hand-selected for the best marbling and tenderness. Whether you're grilling, roasting, or sautéing, this pork tenderloin is sure to be a delicious, juicy addition to your meal.",$3.50,646,Non-Vegan,Non-Gluten-Free
181,Hormel Always Tender Pork Roast,Meat - Pork,"Hormel Always Tender Pork Roast is a premium, high-quality cut of pork that is always juicy and full of flavor. This tender pork roast is perfect for any occasion, whether it's a family dinner or a gathering with friends. Simply season and roast for a delicious, mouthwatering meal that everyone will love. With Hormel's commitment to excellence, you can always trust that this pork roast will deliver exceptional taste and tenderness.",$3.12,909,Non-Vegan,Gluten-Free
182,Oscar Mayer Selects Natural Applewood Smoked Pork,Meat - Pork,"Oscar Mayer Selects Natural Applewood Smoked Pork is a high-quality pork product that has been slow smoked over real applewood for a rich and savory flavor. Made with all-natural pork and no artificial ingredients, this premium meat has a deliciously smoky taste that is perfect for adding a bold, mouthwatering flavor to any dish. Whether it's used in sandwiches, salads, or as a standalone protein, this pork product is sure to satisfy your cravings for delicious, natural flavor.",$1.20,686,Vegan,Gluten-Free
183,Tyson Fresh Pork Spare Ribs,Meat - Pork,"Tyson Fresh Pork Spare Ribs are a mouthwatering, high-quality cut of meat that is perfect for grilling or slow-cooking. These ribs are tender, juicy, and packed with delicious pork flavor, making them a favorite for barbecue enthusiasts and home cooks alike. Whether you're hosting a summer cookout or simply craving a hearty and satisfying meal, Tyson Fresh Pork Spare Ribs are sure to impress.",$4.31,449,Vegan,Gluten-Free
184,Farmland All Natural Pork Shoulder,Meat - Pork,"Farmland All Natural Pork Shoulder is a succulent and flavorful cut of pork, perfect for roasting, grilling, or slow cooking. Raised without any added hormones or antibiotics, this premium pork shoulder offers a rich, juicy taste that is sure to satisfy any meat lover. Whether you're making pulled pork sandwiches, hearty soups, or savory stews, Farmland All Natural Pork Shoulder is the ideal choice for delicious, high-quality pork.",$3.66,583,Non-Vegan,Gluten-Free
185,Hatfield Hardwood Smoked Thick Cut Bacon,Meat - Pork,"Hatfield Hardwood Smoked Thick Cut Bacon is a savory and delicious pork product that is perfect for breakfast or adding a smoky, savory flavor to any dish. It is made with high-quality cuts of pork and is expertly smoked with hardwood for a rich and robust flavor. Each slice is thick and meaty, providing a satisfying and hearty eating experience. Whether enjoyed on its own or added to sandwiches, salads, or pasta dishes, Hatfield Hardwood Smoked Thick Cut Bacon will add a delicious touch to any meal.",$2.21,656,Non-Vegan,Non-Gluten-Free
186,Johnsonville Original Bratwurst,Meat - Pork,"Johnsonville Original Bratwurst is a classic pork sausage made with premium cuts of meat and seasoned with the perfect blend of herbs and spices. This traditional German-style bratwurst is juicy, flavorful, and perfect for grilling or pan-frying. Whether enjoyed on a bun with sauerkraut and mustard or added to your favorite recipes, Johnsonville Original Bratwurst is sure to be a hit at any gathering.",$2.11,365,Vegan,Gluten-Free
187,Plumrose Premium Sliced Honey Ham,Meat - Pork,"Plumrose Premium Sliced Honey Ham is a high-quality, savory pork product that is delicately seasoned with sweet and tangy honey. Each slice is expertly cured and smoked to create a rich, flavorful ham with a hint of sweetness. Perfect for sandwiches, charcuterie boards, or as a tasty protein addition to any meal.",$2.24,274,Non-Vegan,Non-Gluten-Free
188,Rupari Food Services St. Louis Style Pork Ribs,Meat - Pork,"Rupari Food Services St. Louis Style Pork Ribs are a mouthwatering, tender and flavorful pork product. These ribs are expertly prepared in the St. Louis style, featuring a perfect balance of seasoning and a delicious smoky flavor. Whether grilled, smoked, or baked, these pork ribs are sure to be a hit at any barbecue or family gathering. Enjoy the taste of authentic Southern-style ribs with Rupari Food Services St. Louis Style Pork Ribs.",$2.70,744,Non-Vegan,Gluten-Free
189,Farm Promise All Natural Pork Chops,Meat - Pork,"Farm Promise All Natural Pork Chops are a high-quality, delicious option for any meal. These pork chops are sourced from humanely raised pigs on family farms, ensuring the highest standard of animal welfare and sustainability. With no added hormones or antibiotics, these pork chops are all-natural and free from artificial ingredients, delivering the pure, savory taste of premium pork. Whether grilled, roasted, or sautéed, Farm Promise All Natural Pork Chops are perfect for any culinary creation.",$3.82,980,Non-Vegan,Non-Gluten-Free
190,Salmon fillets,Seafood - Fish,"Salmon fillets are a premium seafood product, featuring tender, succulent cuts of fresh salmon. Sourced from the pristine waters of the North Atlantic, these fillets are known for their delicate, buttery texture and rich, flavorful taste. Whether grilled, baked, or seared, salmon fillets are a versatile and healthy option for any seafood lover. Enjoyed for their high protein content and omega-3 fatty acids, these fillets are perfect for creating gourmet meals that will impress any seafood enthusiast.",$4.24,853,Non-Vegan,Gluten-Free
191,Alaskan cod,Seafood - Fish,"Alaskan cod is a premium seafood product caught in the icy waters of the North Pacific. Known for its mild flavor, tender texture, and large flakes, Alaskan cod is a versatile fish that can be baked, grilled, or fried to perfection. It is a popular choice for fish and chips, fish tacos, and various seafood dishes. Sustainably sourced and packed with essential nutrients, Alaskan cod is a delicious and healthy option for seafood lovers.",$3.10,594,Non-Vegan,Gluten-Free
192,Tuna steaks,Seafood - Fish,"Tuna steaks are thick slices of premium, flavorful tuna fillets, perfect for grilling, searing, or broiling. With their firm texture and rich taste, these tuna steaks are a delicious and healthy choice for seafood lovers. Whether marinated and grilled to perfection or simply seasoned and pan-seared, tuna steaks are a versatile and delectable addition to any seafood dish.",$2.65,563,Non-Vegan,Non-Gluten-Free
193,Tilapia fillets,Seafood - Fish,"Tilapia fillets are a delicious and versatile seafood option. These boneless, skinless fillets are known for their mild, slightly sweet flavor and tender, flaky texture. Whether baked, broiled, grilled, or fried, tilapia fillets make a perfect addition to any seafood dish. They are a great source of protein and can be easily seasoned and served with a variety of sides for a healthy and satisfying meal.",$4.40,197,Non-Vegan,Non-Gluten-Free
194,Mahi-mahi fillets,Seafood - Fish,"Mahi-mahi fillets are a delectable seafood option, known for their sweet and mild flavor. These white and firm fillets are sourced from the tropical waters of the Pacific and are a versatile choice for grilling, pan-searing, or baking. With their tender texture and delicate taste, Mahi-mahi fillets are a popular choice for seafood lovers looking to elevate their culinary creations. Dive into the delicious world of Mahi-mahi fillets for a delightful dining experience.",$1.08,937,Non-Vegan,Non-Gluten-Free
195,Flounder fillets,Seafood - Fish,"Flounder fillets are a delicious and versatile seafood option. These boneless, skinless fillets are carefully cut and expertly packaged to guarantee freshness and quality. With their mild and delicate flavor, flounder fillets can be easily prepared in a variety of ways, from pan-searing to grilling to baking. Whether you're a seafood enthusiast or looking to add more variety to your meals, flounder fillets are a fantastic choice for any culinary creation.",$4.83,455,Non-Vegan,Gluten-Free
196,Rainbow trout,Seafood - Fish,"Rainbow trout is a delicious and tender fish with a light, delicate flavor. This freshwater fish is known for its beautiful pink-orange flesh and distinctive rainbow-like coloring. It is a versatile seafood option that can be grilled, pan-seared, or baked for a healthy and flavorful meal. Enjoyed by seafood lovers for its mild taste and flaky texture, rainbow trout is a popular choice for fish enthusiasts.",$4.93,762,Vegan,Non-Gluten-Free
197,Halibut fillets,Seafood - Fish,"Halibut fillets are a premium seafood product made from the tender and flaky white flesh of the halibut fish. Known for their mild, sweet flavor and firm texture, these fillets are perfect for grilling, sautéing, or baking. Sourced from sustainable and responsible fisheries, halibut fillets are a delicious and nutritious option for a seafood dinner.",$2.25,965,Vegan,Gluten-Free
198,Catfish fillets,Seafood - Fish,"Catfish fillets are a delicious and versatile seafood option. These boneless, skinless fillets are known for their mild, sweet flavor and tender texture. Whether baked, grilled, or fried, catfish fillets make a satisfying and healthy meal option that will surely delight any seafood lover.",$3.35,475,Vegan,Non-Gluten-Free
199,Swordfish steaks,Seafood - Fish,"Swordfish steaks are a premium cut of fish known for their firm texture and rich, meaty flavor. These thick, delicious steaks are great for grilling, pan-searing, or broiling, and are perfect for seafood lovers looking for a hearty, flavorful meal. High in protein and packed with omega-3 fatty acids, swordfish steaks are a nutritious and delectable option for any seafood dish.",$2.80,317,Non-Vegan,Gluten-Free
200,Shrimp,Seafood - Shellfish,"'Shrimp' is a premium seafood product that offers sweet and succulent shellfish. Sourced from the finest and freshest shrimp, our product is perfect for grilling, sautéing, or adding to your favorite pasta dishes. Indulge in the delicate and buttery flavor of our shrimp, for a truly satisfying culinary experience.",$4.88,713,Non-Vegan,Gluten-Free
201,Lobster,Seafood - Shellfish,"Lobster is a premium shellfish known for its succulent, sweet, and tender meat. Sourced from the cold waters of the North Atlantic, our lobster is carefully harvested and delivered fresh to your table. Whether steamed, grilled, or added to pasta dishes, lobster is a luxurious and flavorful addition to any seafood meal.",$2.67,872,Non-Vegan,Gluten-Free
202,Crab,Seafood - Shellfish,"Fresh and succulent, our Crab is a premium shellfish delicacy. With its sweet and tender meat, it is perfect for adding a luxurious touch to any seafood dish. Whether enjoyed on its own or as part of a recipe, our Crab promises to elevate your dining experience with its exquisite taste and texture.",$4.69,742,Vegan,Gluten-Free
203,Clams,Seafood - Shellfish,"Clams are a delicious and versatile shellfish, prized for their sweet and briny flavor. These ocean gems can be enjoyed in a variety of dishes, from classic clam chowder to pasta dishes and paella. With their tender flesh and rich taste, clams are a must-have for any seafood lover.",$3.06,784,Non-Vegan,Gluten-Free
204,Mussels,Seafood - Shellfish,"Mussels are a type of shellfish known for their tender meat and distinctive briny flavor. These delicious bivalves are prized for their versatility and can be enjoyed in a wide variety of recipes, including soups, pastas, and seafood stews. Mussels are also a great source of protein and are rich in vitamins and minerals, making them a popular choice for seafood lovers looking to add a healthy and flavorful option to their meals.",$3.19,435,Vegan,Gluten-Free
205,Oysters,Seafood - Shellfish,"Oysters are a type of delicious shellfish known for their briny flavor and smooth, creamy texture. These ocean-dwelling mollusks are popularly enjoyed on the half-shell, grilled, or cooked in a variety of dishes. Oysters are prized for their unique taste and are a beloved delicacy for seafood enthusiasts.",$3.17,854,Vegan,Gluten-Free
206,Scallops,Seafood - Shellfish,"Scallops are a type of shellfish known for their delicate, sweet, and buttery flavor. They are tender and succulent, making them a popular choice for seafood lovers. Perfect for grilling, searing, or pan-frying, scallops are a versatile ingredient that can be used in a variety of dishes, from pastas to salads to appetizers. Rich in protein and low in fat, scallops are a nutritious addition to any meal.",$1.81,848,Vegan,Gluten-Free
207,Crawfish,Seafood - Shellfish,"Crawfish are freshwater crustaceans with a sweet and tender meat, often likened to a combination of shrimp and crab. These small shellfish are popular in Southern and Cajun cuisine, and are typically enjoyed boiled with Cajun spices for a flavorful and satisfying meal. Their delicate flavor and texture make them a versatile ingredient in a variety of seafood dishes.",$4.66,556,Non-Vegan,Gluten-Free
208,Octopus,Seafood - Shellfish,"Octopus is a delightful seafood delicacy known for its tender, mildly sweet flesh and unique, chewy texture. This versatile shellfish can be grilled, roasted, or used in a variety of dishes, from sushi to pasta. With its distinct flavor and striking appearance, Octopus is a popular choice for seafood enthusiasts looking to add a touch of sophistication to their culinary creations.",$1.28,337,Non-Vegan,Non-Gluten-Free
209,Squid,Seafood - Shellfish,"Squid, also known as calamari, is a type of shellfish prized for its tender, slightly chewy texture and delicate flavor. It can be prepared in a variety of ways, including grilled, fried, or sautéed, and is a popular addition to seafood pastas, salads, and risottos. With its versatile nature and mild taste, squid is a favorite among seafood lovers looking to add a touch of elegance to their meals.",$1.96,960,Vegan,Non-Gluten-Free
210,Beyond Meat Burger,Diet-Vegan,"The Beyond Meat Burger is a plant-based, vegan alternative to traditional burgers. Made with ingredients such as pea protein, beet juice extract, and coconut oil, this burger offers a delicious and juicy patty that closely mimics the taste and texture of meat. Packed with protein and free from cholesterol, the Beyond Meat Burger is a guilt-free option for those looking to enjoy a satisfying and plant-based burger experience.",$2.21,144,Vegan,Non-Gluten-Free
211,Daiya Dairy-Free Cheese,Diet-Vegan,"Daiya Dairy-Free Cheese is a delicious and versatile vegan cheese alternative. Made from plant-based ingredients, this dairy-free cheese is perfect for those following a vegan or dairy-free diet. With a rich and creamy texture, it melts and stretches just like traditional cheese, making it ideal for pizzas, pastas, sandwiches, and more. Enjoy the indulgent taste of cheese without any of the dairy.",$3.50,659,Vegan,Gluten-Free
212,Gardein Meatless Chick'n,Diet-Vegan,"Gardein Meatless Chick'n is a delicious and protein-packed vegan alternative to chicken. Made with plant-based ingredients, it provides a satisfying meatless option for those following a vegan or vegetarian diet. It has a great texture and flavor, making it an easy and versatile ingredient for all your favorite recipes. Enjoy the taste of chicken without any of the guilt or animal products with Gardein Meatless Chick'n.",$1.59,797,Vegan,Non-Gluten-Free
213,Silk Almond Milk,Diet-Vegan,"Silk Almond Milk is a delicious and creamy plant-based alternative to dairy milk. Made from real almonds and free from any animal products, this vegan-friendly beverage is packed with nutrients and is perfect for those seeking a dairy-free lifestyle. Enjoy Silk Almond Milk in your morning cereal, smoothies, or as a refreshing drink on its own. It's a guilt-free, tasty and satisfying option for anyone looking to embrace a vegan diet.",$1.15,245,Non-Vegan,Gluten-Free
214,Amy's Organic Vegan Pizza,Diet-Vegan,"Amy's Organic Vegan Pizza is a delectable plant-based pizza made with high-quality organic ingredients. This delicious pizza is free from animal products, making it a perfect choice for those following a vegan diet. Topped with savory tomato sauce, dairy-free cheese, and a variety of fresh vegetables, this pizza offers a satisfying and flavorful dining experience for vegans and non-vegans alike. Enjoy a guilt-free slice of pizza with Amy's Organic Vegan Pizza.",$1.65,511,Vegan,Gluten-Free
215,Field Roast Vegan Sausages,Diet-Vegan,"Field Roast Vegan Sausages are a delicious and satisfying plant-based alternative to traditional sausages. Made with high-quality, wholesome ingredients like grains, vegetables, and spices, these sausages are packed with flavor and protein. Perfect for grilling, pan-frying, or adding to your favorite recipes, these vegan sausages are a tasty and cruelty-free option for those following a vegan or plant-based diet.",$2.14,799,Vegan,Gluten-Free
216,Tofurky Deli Slices,Diet-Vegan,"Tofurky Deli Slices are a delicious and versatile vegan alternative to traditional deli meats. Made from organic tofu and seasoned with herbs and spices, these slices are perfect for sandwiches, wraps, salads, and more. A healthy and animal-friendly option for those following a vegan or plant-based diet.",$4.98,213,Vegan,Gluten-Free
217,Follow Your Heart Vegan Mayo,Diet-Vegan,"Follow Your Heart Vegan Mayo is a delicious, plant-based alternative to traditional mayonnaise. Made with high-quality, non-GMO ingredients, this creamy and tangy mayo is perfect for sandwiches, salads, and dipping. Whether you're vegan, dairy-free, or just looking for a healthier option, this mayo is a tasty and guilt-free choice to add a satisfying kick to your favorite dishes.",$2.60,365,Non-Vegan,Gluten-Free
218,Violife Vegan Cheese,Diet-Vegan,"""Violife Vegan Cheese is a delicious and dairy-free alternative to traditional cheese. Made from natural, plant-based ingredients, this vegan cheese is perfect for those following a vegan or dairy-free diet. It has a rich and creamy texture, and comes in a variety of flavors, making it the perfect addition to sandwiches, salads, and other plant-based dishes.""",$3.69,701,Vegan,Non-Gluten-Free
219,Oatly Oat Milk,Diet-Vegan,"Oatly Oat Milk is a delicious and creamy vegan alternative to traditional dairy milk. Made from high-quality oats, this plant-based milk is a perfect addition to a vegan diet. It is naturally low in fat, cholesterol-free, and a good source of calcium and vitamin D. Whether you use it in your morning coffee, pour it over cereal, or add it to your favorite recipes, Oatly Oat Milk is a versatile and tasty choice for those looking to cut out dairy from their diet.",$4.75,220,Non-Vegan,Gluten-Free
