,SKU,Type,Description,Cost,Quantity (g),Vegan/Non-Vegan,Gluten-Free/Non-Gluten-Free
431,Progresso Chicken Noodle Soup,Canned and Jarred Goods - Soups,"Progresso Chicken Noodle Soup is a comforting and classic soup that is perfect for a quick and easy meal. Made with high-quality ingredients like tender pieces of chicken, hearty noodles, and a flavorful broth, this canned soup is ready to heat and enjoy in no time. Whether you're feeling under the weather or simply craving a warm and savory dish, Progresso Chicken Noodle Soup is a go-to option for satisfying your soup cravings.",$3.18,506,Non-Vegan,Non-Gluten-Free
432,Amy's Organic Lentil Soup,Canned and Jarred Goods - Soups,"Amy's Organic Lentil Soup is a delicious, ready-to-eat soup made with hearty organic lentils and vegetables. This wholesome and flavorful soup is packed in BPA-free cans, making it a convenient option for a quick and satisfying meal. With no GMOs or preservatives, Amy's Organic Lentil Soup is a healthy choice for anyone looking for a tasty and convenient soup option.",$2.39,583,Non-Vegan,Gluten-Free
433,Healthy Choice Chicken with Rice Soup,Canned and Jarred Goods - Soups,"Our Healthy Choice Chicken with Rice Soup is a delicious and nutritious option for a quick and easy meal. Packed with tender pieces of chicken, hearty rice, and a flavorful broth, this soup is a satisfying choice for lunch or dinner. With no artificial flavors or preservatives, you can feel good about enjoying this convenient, canned soup. Just heat, serve, and enjoy a comforting and wholesome meal.",$3.39,592,Vegan,Gluten-Free
434,Annie's Organic Tomato Soup,Canned and Jarred Goods - Soups,"Annie's Organic Tomato Soup is a delicious and wholesome soup made with the finest organic ingredients. This rich and flavorful soup is perfect for a quick and easy meal on a cold day. It is made with ripe, juicy tomatoes and blended with organic cream, creating a velvety smooth texture and a burst of natural sweetness. Enjoy the comforting taste of homemade tomato soup with the convenience of a canned option.",$2.17,162,Vegan,Non-Gluten-Free
435,Swanson Chicken Broth,Canned and Jarred Goods - Soups,"Swanson Chicken Broth is a high-quality canned soup product that offers rich and savory flavors. Made with premium ingredients, this savory chicken broth is perfect for adding depth and flavor to your favorite soups, stews, and other culinary creations. Whether used as a base for homemade recipes or enjoyed on its own as a warm and comforting drink, Swanson Chicken Broth is a versatile and essential pantry staple.",$4.87,118,Non-Vegan,Non-Gluten-Free
436,Chef Boyardee Beef Ravioli,Canned and Jarred Goods - Soups,"Chef Boyardee Beef Ravioli is a delicious canned soup that features tender ravioli filled with savory beef in a rich and hearty tomato sauce. Perfect on its own or paired with crusty bread, this classic and convenient soup is sure to satisfy your craving for a comforting and filling meal. Just heat it up and enjoy a taste of homemade goodness in minutes.",$1.08,973,Non-Vegan,Non-Gluten-Free
437,Pacific Foods Organic Creamy Tomato Soup,Canned and Jarred Goods - Soups,"Pacific Foods Organic Creamy Tomato Soup is a delicious and hearty soup made with high-quality, organic ingredients. Packed in a convenient jar, this soup is perfect for a quick and easy meal at home or on the go. With its creamy texture and rich tomato flavor, it's a comforting and satisfying option for any time of day. Made with no added preservatives or artificial ingredients, this soup is a wholesome choice for those looking for a convenient, organic soup option.",$1.99,251,Vegan,Non-Gluten-Free
438,Wolfgang Puck Signature Tortilla Soup,Canned and Jarred Goods - Soups,"Wolfgang Puck Signature Tortilla Soup is a flavorful and hearty soup made with the finest ingredients. This delicious blend of tomatoes, vegetables, and tender shredded chicken is perfectly seasoned with a hint of spice for a satisfying and comforting meal. Simply heat and serve for a quick and tasty soup that is sure to please your taste buds.",$4.95,493,Vegan,Gluten-Free
439,Knorr Classic French Onion Soup,Canned and Jarred Goods - Soups,"Knorr Classic French Onion Soup is a rich and comforting soup mix that brings the delicious flavors of traditional French onion soup to your table in minutes. Made with high-quality ingredients, this canned soup is perfect for a quick and easy meal or as a starter for a homemade gourmet dinner. Just add water and let the savory aroma of caramelized onions and hearty broth fill your kitchen. Enjoy the taste of France from the convenience of your own home with Knorr Classic French Onion Soup.",$3.50,472,Vegan,Gluten-Free
440,Heinz Ketchup,Condiments - Sauces,"Heinz Ketchup is a classic, tomato-based condiment that is beloved by people of all ages. Its rich, tangy flavor and smooth, thick texture make it the perfect complement to all your favorite foods, from burgers and fries to hot dogs and sandwiches. Made with high-quality, non-GMO ingredients, Heinz Ketchup is a staple in kitchens and restaurants worldwide. Whether you're dipping, spreading, or squeezing, Heinz Ketchup adds a delicious burst of flavor to every bite.",$3.23,565,Vegan,Gluten-Free
441,Sweet Baby Ray's BBQ Sauce,Condiments - Sauces,"Sweet Baby Ray's BBQ Sauce is a delicious and tangy condiment that adds a burst of flavor to any grilled dish. Made with a blend of bold spices, real molasses, and a touch of sweetness, this sauce is perfect for slathering on ribs, burgers, or chicken. Whether you're grilling in the backyard or hosting a cookout, Sweet Baby Ray's BBQ Sauce will elevate your barbecue experience to the next level.",$4.73,810,Vegan,Gluten-Free
442,Sriracha Hot Chili Sauce,Condiments - Sauces,"Sriracha Hot Chili Sauce is a fiery and flavorful condiment that adds a kick to any dish. Made with sun-ripened chili peppers, garlic, and vinegar, this beloved spicy sauce is the perfect addition to stir-fries, noodles, soups, and more. With its signature bright red color and tangy heat, Sriracha Hot Chili Sauce is a must-have for spice lovers everywhere.",$1.50,714,Non-Vegan,Gluten-Free
443,A.1. Steak Sauce,Condiments - Sauces,"A.1. Steak Sauce is a classic condiment that adds bold and savory flavor to steaks, burgers, and other grilled meats. With a rich and tangy taste, it is the perfect complement to your favorite dishes. Made with a blend of herbs and spices, A.1. Steak Sauce has been a staple in kitchens for generations, enhancing the taste of any meal.",$4.38,389,Vegan,Gluten-Free
444,Tabasco Pepper Sauce,Condiments - Sauces,"Tabasco Pepper Sauce is a bold and spicy condiment that adds a kick of flavor to any dish. Made from a unique blend of aged red peppers and vinegar, it is a favorite hot sauce for adding heat to wings, tacos, and other favorite foods. Whether you like it extra spicy or just a hint of heat, Tabasco Pepper Sauce is the perfect accompaniment to spice up your meals.",$3.93,378,Non-Vegan,Non-Gluten-Free
445,Bull's-Eye Original BBQ Sauce,Condiments - Sauces,"Bull's-Eye Original BBQ Sauce is a rich and smoky condiment that adds a bold, tangy flavor to your favorite grilled meats and dishes. Made with high-quality, natural ingredients, this barbecue sauce is a must-have for any BBQ lover. Perfect for marinating, dipping, or slathering on burgers, ribs, and more, Bull's-Eye Original BBQ Sauce is a classic addition to any cookout or meal.",$3.65,200,Vegan,Gluten-Free
446,Cholula Hot Sauce,Condiments - Sauces,"Cholula Hot Sauce is a premium hot sauce made from a blend of arbol and piquin peppers, combined with a unique blend of spices and seasonings. This versatile and flavorful sauce adds a delicious kick to any dish, from eggs and tacos to soups and salads. Made with high-quality ingredients and crafted with care, Cholula Hot Sauce is the perfect condiment for those who love a little heat with their meals.",$2.64,897,Non-Vegan,Gluten-Free
447,Frank's RedHot Original Cayenne Pepper Sauce,Condiments - Sauces,"Frank's RedHot Original Cayenne Pepper Sauce is a classic condiment that adds the perfect combination of flavor and heat to any dish. Made with a blend of aged cayenne peppers, this sauce is the perfect way to spice up your favorite foods. Whether you're using it as a dipping sauce, marinade, or topping, Frank's RedHot Original Cayenne Pepper Sauce is a must-have for any hot sauce lover.",$3.42,730,Vegan,Non-Gluten-Free
448,Hunts Tomato Sauce,Condiments - Sauces,"Hunts Tomato Sauce is a classic and versatile condiment that adds rich, savory flavor to a variety of dishes. Made with premium quality tomatoes and a blend of spices, this sauce is perfect for adding a touch of tangy sweetness to pasta, pizza, meatloaf, and more. Whether used as a base for homemade pizza or as a dipping sauce for breadsticks, Hunts Tomato Sauce is a kitchen staple that brings out the best in your favorite recipes.",$4.86,584,Vegan,Gluten-Free
449,Lee Kum Kee Hoisin Sauce,Condiments - Sauces,"Lee Kum Kee Hoisin Sauce is a traditional Chinese condiment that is sweet, savory, and slightly spicy. Made from selected spices and ground soybeans, this rich and flavorful sauce is perfect for dipping, marinating, or glazing meats, adding depth of flavor to stir-fries, and for creating authentic Asian-inspired dishes. Whether used as a sauce or a marinade, Lee Kum Kee Hoisin Sauce adds a delicious and bold taste to any meal.",$3.07,173,Non-Vegan,Gluten-Free
450,McCormick Organic Ground Turmeric,Condiments - Spices,"McCormick Organic Ground Turmeric is a high-quality spice made from organically grown turmeric root. This vibrant yellow-orange spice adds a warm, earthy flavor and a beautiful color to a variety of dishes, including curries, rice, soups, and more. It is USDA certified organic and non-GMO, ensuring that you are using only the best ingredients in your cooking.",$2.12,658,Vegan,Non-Gluten-Free
451,Lawry's Garlic Salt,Condiments - Spices,"Lawry's Garlic Salt is the perfect combination of garlic and salt, adding a burst of flavor to any dish. Made with quality, natural ingredients, this versatile seasoning is great for enhancing the taste of meats, vegetables, and pasta dishes. Whether used as a rub, marinade, or simply sprinkled on top, Lawry's Garlic Salt is a must-have for elevating the taste of any meal.",$1.91,183,Vegan,Gluten-Free
452,Old Bay Seasoning,Condiments - Spices,"Old Bay Seasoning is a classic blend of herbs and spices that adds a burst of flavor to a variety of dishes. With a perfect balance of savory and sweet, this iconic seasoning is a must-have for seafood, poultry, and even vegetables. Whether you're grilling, steaming, or sautéing, Old Bay Seasoning will take your meals to the next level with its distinct and zesty taste.",$4.96,302,Non-Vegan,Non-Gluten-Free
453,Badia Complete Seasoning,Condiments - Spices,"Badia Complete Seasoning is a versatile blend of herbs and spices that adds a delicious burst of flavor to any dish. This all-purpose seasoning is a perfect combination of garlic, oregano, cumin, and other premium herbs and spices, making it an essential addition to your spice collection. Whether you're grilling, roasting, or sautéing, Badia Complete Seasoning is the perfect way to enhance the taste of your favorite foods. Elevate your cooking with this savory and aromatic seasoning blend.",$4.31,492,Non-Vegan,Non-Gluten-Free
454,Simply Organic Ground Cinnamon,Condiments - Spices,"Simply Organic Ground Cinnamon is a high-quality, certified organic spice that adds a warm and aromatic flavor to any dish. Made from pure, ground cinnamon bark, this spice is perfect for adding to baked goods, oatmeal, coffee, and more. With its rich, sweet taste and enticing aroma, this cinnamon is a must-have in any spice collection.",$4.51,571,Non-Vegan,Non-Gluten-Free
455,Mrs. Dash Original Blend,Condiments - Spices,"Mrs. Dash Original Blend is a versatile and flavorful spice blend that adds a burst of zesty, savory flavor to any dish. Made with a delicious combination of herbs and spices, this salt-free seasoning is perfect for adding a dash of flavor to meats, vegetables, and more. Whether you're grilling, roasting, or sautéing, Mrs. Dash Original Blend is a convenient and delicious way to elevate your favorite recipes.",$3.48,671,Non-Vegan,Non-Gluten-Free
456,Weber Kick'N Chicken Seasoning,Condiments - Spices,"""Weber Kick'N Chicken Seasoning is a zesty blend of spices designed to add a flavorful kick to your chicken dishes. This unique seasoning combines a bold mix of herbs, spices, and savory flavors to elevate the taste of your grilled, roasted, or baked chicken. Perfect for adding a delicious twist to your favorite chicken recipes, Weber Kick'N Chicken Seasoning is a must-have condiment for any poultry lover.""",$3.43,556,Vegan,Non-Gluten-Free
457,Frontier Co-op Organic Black Peppercorns,Condiments - Spices,"Frontier Co-op Organic Black Peppercorns are high-quality, certified organic peppercorns that have been carefully sourced and packaged to maintain their freshness and flavor. These peppercorns are perfect for adding a bold and zesty kick to your favorite recipes, and the organic certification ensures that they have been grown and processed without any synthetic pesticides or additives. Add a sprinkle of these peppercorns to your dishes to elevate the flavor and bring a rich, aromatic depth to your meals.",$4.53,264,Vegan,Non-Gluten-Free
458,Tone's Garlic & Herb Seasoning,Condiments - Spices,"Tone's Garlic & Herb Seasoning is a flavorful blend of garlic, herbs, and spices that adds a delicious and aromatic kick to any dish. Perfect for seasoning meats, vegetables, and sauces, this versatile spice mix is a kitchen essential for adding depth and complexity to your cooking. Whether grilling, roasting, or sautéing, Tone's Garlic & Herb Seasoning is sure to elevate your meals with its savory and zesty flavor profile.",$2.34,829,Non-Vegan,Non-Gluten-Free
459,Durkee Ground Mustard,Condiments - Spices,"Durkee Ground Mustard is a zesty and aromatic spice that adds a bold and tangy flavor to a variety of dishes. Made from high-quality mustard seeds, this finely ground spice is perfect for seasoning meats, dressings, sauces, and marinades. Elevate your culinary creations with the distinctive taste of Durkee Ground Mustard.",$2.62,609,Non-Vegan,Non-Gluten-Free
460,Kraft Classic Caesar Dressing,Condiments - Dressings,"Kraft Classic Caesar Dressing is a rich and creamy dressing made with high-quality ingredients, including Parmesan cheese, garlic, and anchovies, to create the perfect blend of flavors. This classic dressing is ideal for drizzling over Caesar salads, as a dip for veggies, or as a marinade for chicken or seafood. Add a delicious touch of indulgence to your favorite dishes with Kraft Classic Caesar Dressing.",$1.42,153,Non-Vegan,Non-Gluten-Free
461,Hidden Valley Ranch Dressing,Condiments - Dressings,"Hidden Valley Ranch Dressing is a rich and creamy blend of tangy buttermilk, garlic, and herbs. Perfect for drizzling over salads, dipping vegetables, or even as a sandwich spread, this iconic dressing adds a burst of flavor to any dish. Made with quality ingredients, it's a classic condiment that is sure to become a staple in your kitchen.",$1.53,197,Non-Vegan,Gluten-Free
462,Hellmann's Real Mayonnaise,Condiments - Dressings,"Hellmann's Real Mayonnaise is a classic condiment that is perfect for adding rich and creamy flavor to your favorite dishes. Made with high-quality ingredients, this mayonnaise is versatile and can be used as a topping, a dip, or a key ingredient in recipes. Whether you're making a sandwich, a salad, or a dip, Hellmann's Real Mayonnaise is the perfect way to add a delicious touch to any meal.",$4.04,293,Vegan,Gluten-Free
463,Ken's Steak House Creamy Italian Dressing,Condiments - Dressings,"Ken's Steak House Creamy Italian Dressing is a classic, savory dressing perfect for adding rich flavor to salads, sandwiches, and more. Made with high-quality ingredients, this creamy dressing has a perfect balance of tangy Italian herbs and creamy texture, making it a versatile condiment for any dish. Whether you're grilling up a steak or tossing a fresh green salad, this creamy Italian dressing is sure to add a deliciously savory touch to your meal.",$4.35,236,Non-Vegan,Gluten-Free
464,Wish-Bone Italian Salad Dressing,Condiments - Dressings,"Wish-Bone Italian Salad Dressing is a flavorful blend of herbs, spices, and tangy vinegar that adds a delicious and zesty taste to salads, vegetables, and more. Perfect for adding a touch of Italy to your favorite dishes, this dressing is sure to elevate your meals with its bold and versatile flavor.",$3.08,783,Vegan,Non-Gluten-Free
465,Newman's Own Balsamic Vinaigrette,Condiments - Dressings,"Newman's Own Balsamic Vinaigrette is a delicious and flavorful dressing made with high-quality balsamic vinegar, oil, and a blend of herbs and spices. This versatile condiment is perfect for salads, marinades, and as a dipping sauce for bread. Made with all-natural ingredients and no artificial preservatives, Newman's Own Balsamic Vinaigrette is a delicious and healthy addition to any meal. Add a burst of tangy sweetness to your favorite dishes with this classic vinaigrette.",$2.42,870,Non-Vegan,Gluten-Free
466,Heinz Tomato Ketchup,Condiments - Dressings,"Heinz Tomato Ketchup is a classic condiment made with simple and high-quality ingredients. It features the perfect balance of tangy tomatoes, sweet and savory spices, and a smooth, thick texture. It's a versatile addition to a wide range of dishes, from burgers and hot dogs to fries and eggs. This iconic ketchup is a must-have for adding a burst of flavor to any meal.",$2.17,496,Non-Vegan,Gluten-Free
467,French's Classic Yellow Mustard,Condiments - Dressings,"French's Classic Yellow Mustard is a timeless condiment that adds a tangy, slightly spicy flavor to all your favorite dishes. Made with high-quality mustard seeds and a blend of spices, this classic yellow mustard is perfect for hot dogs, burgers, sandwiches, and more. With its smooth and creamy texture, it's a versatile and essential addition to any kitchen pantry.",$1.71,650,Non-Vegan,Gluten-Free
468,Marie's Chunky Blue Cheese Dressing,Condiments - Dressings,"Marie's Chunky Blue Cheese Dressjsonig is a creamy and flavorful dressing made with chunks of real blue cheese, perfect for dressing up salads, wings, burgers, and more. Made with high-quality ingredients, it adds a rich and tangy kick to any dish.",$1.75,514,Non-Vegan,Gluten-Free
469,Annie's Organic Honey Mustard Dressing,Condiments - Dressings,"Annie's Organic Honey Mustard Dressing is a flavorful and wholesome condiment perfect for adding a touch of sweetness to your favorite dishes. Made with organic ingredients, this dressing is a delicious blend of tangy mustard and smooth honey, perfect for drizzling over salads, sandwiches, and more. With its high-quality and natural ingredients, Annie's Organic Honey Mustard Dressing is a must-have for any kitchen pantry.",$2.78,359,Vegan,Gluten-Free
470,Tylenol Extra Strength Pain Reliever,Health and Beauty - Medicines,"Tylenol Extra Strength Pain Reliever is a trusted and effective over-the-counter medication for relieving a variety of aches and pains, including headaches, muscle aches, and arthritis. This extra strength formula provides fast, long-lasting relief, and is gentle on the stomach. With its active ingredient, acetaminophen, this medicine is a go-to choice for those seeking relief from moderate to severe pain. Keep Tylenol Extra Strength Pain Reliever on hand for quick and reliable pain relief.",$4.29,173,Vegan,Gluten-Free
471,Advil Liqui-Gels,Health and Beauty - Medicines,"Advil Liqui-Gels are a fast-acting pain relief medication that provides relief from aches, pains, and fevers. The liqui-gels are easy to swallow and work quickly to alleviate discomfort, making them a convenient and effective choice for on-the-go relief. Whether you're dealing with headaches, muscle aches, or menstrual cramps, Advil Liqui-Gels provide powerful pain relief in a convenient format.",$2.15,128,Non-Vegan,Non-Gluten-Free
472,Claritin Non-Drowsy Allergy Relief,Health and Beauty - Medicines,"Claritin Non-Drowsy Allergy Relief is a fast-acting medicine designed to provide relief from allergy symptoms such as sneezing, runny nose, itchy, watery eyes, and itching of the nose and throat. This non-drowsy formula allows users to combat their allergies without feeling tired or sluggish. Perfect for those with busy lifestyles who need effective relief without sacrificing productivity.",$3.61,382,Non-Vegan,Non-Gluten-Free
473,Pepto-Bismol Stomach Relief,Health and Beauty - Medicines,"Pepto-Bismol Stomach Relief is a fast-acting and effective medicine to provide relief from common stomach issues such as indigestion, heartburn, and nausea. This pink, soothing liquid helps to coat the stomach lining and alleviate discomfort, making it an essential product to have on hand for anyone experiencing digestive discomfort. With a pleasant taste and convenient liquid form, Pepto-Bismol Stomach Relief offers quick relief for a variety of stomach-related ailments.",$3.64,812,Vegan,Non-Gluten-Free
474,Tums Antacid Tablets,Health and Beauty - Medicines,"Tums Antacid Tablets are an effective and fast-acting solution for heartburn and indigestion. This over-the-counter medicine helps neutralize stomach acid to provide quick relief from discomfort, and is available in a variety of flavors to suit individual preferences. With their convenient tablet format, Tums Antacid Tablets are a must-have for anyone seeking relief from common digestive issues.",$1.84,306,Vegan,Non-Gluten-Free
475,Dramamine Motion Sickness Relief,Health and Beauty - Medicines,"Dramamine Motion Sickness Relief is a trusted and reliable over-the-counter medicine that provides fast relief from symptoms of motion sickness such as nausea, dizziness, and vomiting. Whether you're traveling by car, boat, or air, Dramamine can help alleviate discomfort and allow you to enjoy your journey with ease. With a non-drowsy formula, it's perfect for anyone looking to relieve motion sickness symptoms without feeling sleepy. Keep a pack of Dramamine on hand for all your travel adventures.",$4.35,388,Non-Vegan,Gluten-Free
476,Robitussin Cough Syrup,Health and Beauty - Medicines,"Robitussin Cough Syrup is a trusted and effective medicine for relieving coughs and chest congestion. This non-drowsy formula provides fast relief from cough symptoms, allowing you to breathe easier and feel better. With its proven cough-suppressant and expectorant properties, Robitussin Cough Syrup is a go-to remedy for soothing and managing coughs due to colds or respiratory infections.",$2.21,822,Non-Vegan,Gluten-Free
477,Theraflu Cold and Flu Medicine,Health and Beauty - Medicines,"Theraflu Cold and Flu Medicine is a powerful over-the-counter medication designed to provide fast and effective relief from cold and flu symptoms. With a combination of proven cold and flu-fighting ingredients, this medicine helps alleviate congestion, cough, sore throat, and fever, allowing you to quickly start feeling better. Its easy-to-use, convenient form makes it perfect for use at home or on-the-go. Say goodbye to the discomfort of cold and flu with Theraflu Cold and Flu Medicine.",$2.82,386,Non-Vegan,Non-Gluten-Free
478,Zyrtec Allergy Tablets,Health and Beauty - Medicines,"Zyrtec Allergy Tablets are a non-drowsy antihistamine medication designed to provide fast and effective relief from allergies. With just one tablet, users can experience relief from symptoms such as sneezing, runny nose, itchy eyes, and more. Whether it's pollen, pet dander, or other common allergens, Zyrtec Allergy Tablets offer long-lasting relief to help you get back to feeling your best.",$4.02,914,Non-Vegan,Gluten-Free
479,Excedrin Migraine Pain Reliever,Health and Beauty - Medicines,"Excedrin Migraine Pain Reliever is an over-the-counter medication specifically designed to provide fast and effective relief for migraine headaches. It contains a powerful combination of pain relievers and caffeine to target the intense pain and symptoms associated with migraines, such as sensitivity to light and sound. This trusted formula is clinically proven to help alleviate migraine discomfort, allowing you to get back to your day with greater ease and comfort.",$2.12,664,Non-Vegan,Non-Gluten-Free
480,Dove Beauty Bar,Health and Beauty - Personal Care,"The Dove Beauty Bar is a gentle cleanser that nourishes and hydrates the skin, leaving it feeling soft and smooth. Enriched with moisturizing cream and gentle cleansers, this bar is perfect for daily use on the face, body, and hands. It helps to maintain the skin's natural moisture balance, making it suitable for all skin types. The Dove Beauty Bar leaves the skin feeling clean, fresh, and beautifully radiant.",$4.15,881,Non-Vegan,Non-Gluten-Free
481,Crest 3D White Toothpaste,Health and Beauty - Personal Care,"Crest 3D White Toothpaste is a premium toothpaste designed to whiten and brighten your smile. Its advanced formula removes up to 80% of surface stains, leaving your teeth noticeably whiter in just a few days. The toothpaste also strengthens enamel and protects against future stains, while leaving your breath fresh and your mouth feeling clean. Say goodbye to yellowing and hello to a radiant, confident smile with Crest 3D White Toothpaste.",$1.11,734,Vegan,Non-Gluten-Free
