,SKU,Type,Description,Cost,Quantity (g),Vegan/Non-Vegan,Gluten-Free/Non-Gluten-Free
0,Great Value Whole Milk,Dairy - Milk,"Great Value Whole Milk is a rich and creamy dairy product that is produced from high-quality, Grade-A milk. This wholesome and nutritious milk is a great source of calcium and essential nutrients. Perfect for enjoying on its own, adding to recipes, or incorporating into your morning cereal, Great Value Whole Milk is a delicious and versatile choice for all your dairy needs.",$1.61,524,Non-Vegan,Gluten-Free
1,Horizon Organic Milk,Dairy - Milk,"Horizon Organic Milk is a delicious and nutritious dairy product made from the highest quality, organic ingredients. Our milk is sourced from happy, healthy cows that are raised on organic pastures, free from synthetic hormones and pesticides. With a creamy texture and wholesome taste, Horizon Organic Milk is a great choice for anyone looking for a sustainably produced, organic dairy option. Enjoy it on its own, in your morning cereal, or as a key ingredient in your favorite recipes.",$3.72,358,Vegan,Non-Gluten-Free
2,Silk Almond Milk,Dairy - Milk,"Silk Almond Milk is a delicious and nutritious non-dairy milk alternative made from wholesome almonds. It is creamy, smooth, and rich in flavor, perfect for drinking on its own, pouring over cereal, or adding to recipes. This plant-based milk is a great source of calcium, vitamin D, and vitamin E, making it an excellent choice for anyone looking to incorporate more plant-based options into their diet. With no added sugar and only 60 calories per serving, Silk Almond Milk is a guilt-free way to enjoy the creamy goodness of milk without the dairy.",$1.46,556,Vegan,Gluten-Free
3,Fairlife Ultra-Filtered Milk,Dairy - Milk,"Fairlife Ultra-Filtered Milk is a premium dairy product that is high in protein and calcium, with a rich and creamy taste. Using an innovative filtration process, Fairlife removes lactose and focuses on delivering more of the natural goodness found in milk, making it an excellent choice for those looking for a nutritious and delicious milk option. Whether enjoyed on its own or used in cooking and baking, Fairlife Ultra-Filtered Milk is a top-quality choice for those seeking a superior milk experience.",$1.75,870,Vegan,Non-Gluten-Free
4,Organic Valley 2% Milk,Dairy - Milk,"Organic Valley 2% Milk is a delicious and nutritious dairy product that is perfect for those looking for a healthier option. Made with organic, non-GMO milk from pasture-raised cows, it has a rich and creamy flavor with just the right amount of fat. This milk is great for drinking on its own, adding to cereal, or using in recipes. Plus, it's produced in a sustainable and environmentally friendly manner, making it a great choice for both your health and the planet.",$3.79,767,Vegan,Gluten-Free
5,Hood 1% Milk,Dairy - Milk,"Hood 1% Milk is a low-fat, high-quality dairy product that is perfect for those looking for a lighter milk option. It is rich and creamy, with a smooth texture that is perfect for drinking on its own, adding to cereal, or incorporating into your favorite recipes. With just 1% fat, it is a healthier choice without sacrificing taste. Enjoy the goodness of Hood 1% Milk in every glass.",$4.80,623,Non-Vegan,Non-Gluten-Free
6,Promised Land Midnight Chocolate Milk,Dairy - Milk,"Indulge in the rich and creamy taste of Promised Land Midnight Chocolate Milk. Made with the finest cocoa and fresh, high-quality milk, this decadent beverage is perfect for satisfying your sweet tooth. Whether enjoyed on its own or used as a delicious addition to your favorite recipes, Promised Land Midnight Chocolate Milk promises to be an irresistible treat for all chocolate lovers.",$2.57,835,Non-Vegan,Non-Gluten-Free
7,TruMoo Strawberry Milk,Dairy - Milk,"TruMoo Strawberry Milk is a delicious and creamy dairy milk product infused with the vibrant flavor of fresh strawberries. Made with high-quality, wholesome ingredients, it is a perfect blend of rich, nutritious milk and sweet, fruity strawberry taste. Enjoyed by kids and adults alike, TruMoo Strawberry Milk is a delightful and refreshing beverage choice for any time of day.",$2.95,101,Non-Vegan,Gluten-Free
8,Darigold Lactose-Free 2% Milk,Dairy - Milk,"Darigold Lactose-Free 2% Milk is a delicious and nutritious dairy option for those who are lactose intolerant or simply looking for a lactose-free alternative. This smooth and creamy milk is packed with essential nutrients and has all the goodness of regular milk without the discomfort of lactose. Enjoy it in your morning cereal, coffee, or as a refreshing drink on its own.",$2.80,281,Vegan,Gluten-Free
9,Lactaid Whole Milk,Dairy - Milk,"Lactaid Whole Milk is a delicious and nutritious milk product that is perfect for those with lactose intolerance. Made with real, high-quality whole milk, it is rich, creamy, and packed with essential nutrients like calcium and vitamin D. Lactaid Whole Milk is also lactose-free, making it easy to digest and gentle on the stomach. Enjoy the classic taste of whole milk without any discomfort with Lactaid Whole Milk.",$2.66,671,Non-Vegan,Non-Gluten-Free
10,Kraft Singles,Dairy - Cheese,"Kraft Singles is a classic American cheese product known for its smooth and creamy texture. This individually wrapped, sliced cheese is perfect for making grilled cheese sandwiches, topping burgers, or simply enjoyed on its own. Made with natural cheese and no artificial flavors, Kraft Singles is a convenient and delicious addition to any meal.",$2.84,702,Vegan,Gluten-Free
11,Tillamook Cheddar,Dairy - Cheese,"Tillamook Cheddar is a premium cheese made from high-quality, locally-sourced dairy. It has a rich, creamy texture and a sharp, tangy flavor that makes it perfect for snacking, cooking, or adding to your favorite dishes. Sourced from the fertile lands of the Pacific Northwest, Tillamook Cheddar is known for its superior taste and quality, making it a favorite among cheese lovers everywhere.",$3.12,160,Non-Vegan,Non-Gluten-Free
12,Sargento String Cheese,Dairy - Cheese,"Sargento String Cheese is a delicious and wholesome snack made from high-quality, natural cheese. Each individually wrapped stick of string cheese is a good source of calcium and protein, making it an ideal on-the-go snack for both kids and adults. With its smooth and creamy texture, Sargento String Cheese is perfect for enjoying as a quick and satisfying snack at any time of the day.",$4.70,611,Vegan,Non-Gluten-Free
13,Philadelphia Cream Cheese,Dairy - Cheese,"Philadelphia Cream Cheese is a rich and creamy dairy product that has been a staple in households for generations. Made from fresh milk and cream, it has a smooth texture and a deliciously mild flavor. This versatile cheese can be used in a wide variety of recipes, from cheesecakes and dips to creamy pasta dishes. Whether spread on a bagel or used as a key ingredient in your favorite dish, Philadelphia Cream Cheese adds a decadent touch to any meal.",$2.21,764,Non-Vegan,Non-Gluten-Free
14,Cracker Barrel Extra Sharp Cheddar,Dairy - Cheese,"Cracker Barrel Extra Sharp Cheddar is a rich and bold cheese with a sharp and robust flavor. Made from high-quality dairy, this cheese has been aged for an extended period to develop its intense taste and smooth texture. Perfect for adding a burst of flavor to any dish or enjoying on its own with a glass of wine.",$1.31,430,Non-Vegan,Gluten-Free
15,Babybel Mini Cheese,Dairy - Cheese,"""Babybel Mini Cheese is a delicious and convenient snack-sized cheese that is perfect for on-the-go. Made from high-quality dairy, each bite-sized cheese is individually wrapped for freshness and is sure to satisfy your cheese cravings. With its smooth and creamy texture, Babybel Mini Cheese is a favorite among both kids and adults alike.""",$2.60,425,Vegan,Gluten-Free
16,Frigo Cheese Heads,Dairy - Cheese,"Frigo Cheese Heads are delicious, convenient cheese snacks perfect for on-the-go. Made with high-quality, real cheese, these individually wrapped snacks are great for packed lunches, snacking, or as a protein-packed pick-me-up. With a variety of flavors and types available, there's a Frigo Cheese Head for every cheese lover.",$4.62,601,Vegan,Non-Gluten-Free
17,Athenos Feta Cheese,Dairy - Cheese,"Athenos Feta Cheese is a crumbly and tangy cheese made from high-quality ingredients. This traditional Greek cheese is perfect for adding a rich and savory flavor to salads, pastas, and sandwiches. Made with the perfect blend of creamy and salty notes, Athenos Feta Cheese is a versatile and delicious addition to any dish.",$2.92,566,Vegan,Gluten-Free
18,Laughing Cow Cheese,Dairy - Cheese,"Laughing Cow Cheese is a creamy and flavorful cheese that is perfect for snacking and cooking. It is made from the finest quality milk and aged to perfection, featuring a smooth and mild taste that is loved by cheese enthusiasts of all ages. This versatile and spreadable cheese is a great addition to any charcuterie board, sandwich, or recipe, and is sure to add a touch of indulgence to any meal.",$4.39,187,Vegan,Non-Gluten-Free
19,Cabot Pepper Jack Cheese,Dairy - Cheese,"Cabot Pepper Jack Cheese is a spicy and flavorful cheese that combines the creamy goodness of traditional pepper jack with the high-quality, natural ingredients of Cabot Cheese. This semi-soft cheese is infused with a blend of spicy peppers, giving it a distinctive and zesty kick. It is perfect for adding a spicy twist to your favorite recipes or simply enjoying as a delicious snack.",$4.70,598,Vegan,Non-Gluten-Free
20,Chobani Greek Yogurt,Dairy - Yogurt,"Chobani Greek Yogurt is a creamy and delicious yogurt made with high-quality, natural ingredients. It is crafted using traditional Greek methods for a thick and rich texture, and is packed with protein and probiotics for a nutritious and satisfying snack. Available in a variety of flavors, Chobani Greek Yogurt is a versatile and healthy choice for any time of day.",$1.53,577,Vegan,Non-Gluten-Free
21,Dannon Oikos Triple Zero Yogurt,Dairy - Yogurt,"Dannon Oikos Triple Zero Yogurt is a delicious and creamy Greek yogurt that is free of added sugars, artificial sweeteners, and fat. Packed with 15g of protein and 0% fat, this yogurt is a guilt-free and satisfying snack option. With a variety of flavors to choose from, it's the perfect choice for anyone looking for a healthy and delicious yogurt option.",$2.96,761,Vegan,Gluten-Free
22,Yoplait Original Yogurt,Dairy - Yogurt,"Yoplait Original Yogurt is a creamy and delicious dairy yogurt made with high-quality ingredients. It comes in a variety of flavors and provides a rich and satisfying snack or breakfast option. With its smooth texture and delightful taste, Yoplait Original Yogurt is perfect for enjoying on its own or as a versatile ingredient in your favorite recipes. Made with live and active cultures, Yoplait Original Yogurt is a wholesome choice for a nutritious and delicious treat.",$3.38,667,Vegan,Non-Gluten-Free
23,Fage Total 0% Greek Yogurt,Dairy - Yogurt,"Fage Total 0% Greek Yogurt is a creamy and tangy yogurt made from the finest quality milk. With 0% fat and a rich, thick texture, this yogurt is a delicious and healthy option for anyone looking to enjoy the authentic taste of Greek yogurt. Packed with protein and probiotics, Fage Total 0% Greek Yogurt is the perfect choice for a nutritious and satisfying snack or ingredient in your favorite recipes.",$4.03,847,Non-Vegan,Gluten-Free
24,Siggi's Skyr Yogurt,Dairy - Yogurt,"Siggi's Skyr Yogurt is a rich and creamy dairy yogurt made with simple ingredients and traditional Icelandic methods. This wholesome and delicious yogurt is high in protein, with a thick and velvety texture that is sure to satisfy your taste buds. Perfect for a quick and satisfying breakfast or a healthy snack throughout the day.",$3.43,649,Vegan,Non-Gluten-Free
25,Stonyfield Organic Yogurt,Dairy - Yogurt,"Stonyfield Organic Yogurt is a delicious and nutritious yogurt made with high-quality organic ingredients. This creamy and smooth yogurt is filled with probiotics and made without the use of artificial hormones, pesticides, or GMOs. Each spoonful is packed with wholesome goodness and a satisfying taste that will leave you coming back for more. Choose Stonyfield Organic Yogurt for a wholesome and flavorful choice in the dairy aisle.",$3.60,924,Non-Vegan,Gluten-Free
26,Activia Probiotic Yogurt,Dairy - Yogurt,"Activia Probiotic Yogurt is a delicious and creamy yogurt that contains live and active probiotic cultures to promote gut health and digestion. Packed with a rich and tangy flavor, this yogurt is a nutritious and convenient snack option for those looking to support their digestive health. Enjoy the benefits of probiotics in every spoonful with Activia Probiotic Yogurt.",$3.60,661,Non-Vegan,Non-Gluten-Free
27,Noosa Yoghurt,Dairy - Yogurt,"Noosa Yoghurt is a creamy, indulgent yogurt made with all-natural ingredients and real fruit purees. Crafted in small batches on the Noosa farm in Colorado, this yogurt is velvety smooth and packed with probiotics for a healthy gut. Available in a variety of delectable flavors, Noosa Yoghurt is a delicious and nutritious treat for any time of day.",$4.21,747,Vegan,Gluten-Free
28,Müller Corner Yogurt,Dairy - Yogurt,"Müller Corner Yogurt is a delicious and creamy yogurt product that comes in a unique corner design, featuring a complementary mix-in such as granola, chocolate balls, or fruit compote. Made with high-quality ingredients and real fruit, Müller Corner Yogurt provides a convenient and indulgent snack option for yogurt lovers on the go. With a wide range of flavors to choose from, including strawberry, vanilla, and blueberry, Müller Corner Yogurt offers a satisfying treat for any time of the day.",$4.50,529,Vegan,Non-Gluten-Free
29,Silk Almond Milk Yogurt,Dairy - Yogurt,"Silk Almond Milk Yogurt is a delicious and creamy dairy-free yogurt made from almond milk. It is a great alternative for those looking for a plant-based, vegan, and lactose-free option. Packed with probiotics and the goodness of almonds, Silk Almond Milk Yogurt is a tasty and nutritious choice for a healthy snack or breakfast option.",$4.16,963,Vegan,Gluten-Free
30,Wonder Bread,Bakery - Bread,"Wonder Bread is a classic white bread that is soft, fluffy, and perfect for sandwiches or toast. Made with simple, high-quality ingredients, this bakery product is loved by all ages for its delicious taste and versatility. Whether you're making a PB&J for the kids or a turkey club for lunch, Wonder Bread is the perfect choice for all your bread needs.",$1.58,313,Non-Vegan,Non-Gluten-Free
31,Sara Lee Bread,Bakery - Bread,"Sara Lee Bread is a delicious and wholesome bread option made with high-quality ingredients and a special blend of flours. Baked fresh daily, it boasts a soft and tender texture with a slightly sweet, nutty flavor. Perfect for sandwiches, toast, or enjoyed on its own, Sara Lee Bread is a favorite choice for families looking for a tasty and nutritious bread option.",$4.42,559,Vegan,Non-Gluten-Free
32,Nature's Own Bread,Bakery - Bread,"Nature's Own Bread is a delicious and wholesome bread product made with the finest natural ingredients. Our bread is baked with care and dedication, using simple, traditional recipes to bring out the best flavor and texture. Made with no artificial preservatives, colors, or flavors, Nature's Own Bread is the perfect choice for those who want a natural, wholesome bread for their everyday meals. With a variety of options including whole wheat, multigrain, and honey wheat, there is a Nature's Own Bread for every taste and preference.",$2.59,974,Vegan,Gluten-Free
33,Dave's Killer Bread,Bakery - Bread,"Dave's Killer Bread is a hearty and nutritious line of bread products made with high-quality, organic ingredients. Each loaf is packed with whole grains, seeds, and fiber, delivering a deliciously dense and satisfying texture. Whether you're looking for a simple slice for your morning toast or a sturdy base for your favorite sandwich, Dave's Killer Bread is sure to become a staple in your kitchen. With a range of flavors to choose from, including organic whole grain, powerseed, and good seed, you can feel good about fueling your day with Dave's Killer Bread.",$2.32,897,Vegan,Gluten-Free
34,Pepperidge Farm Bread,Bakery - Bread,"Pepperidge Farm Bread is a delicious and wholesome bread that is freshly baked at our artisanal bakery. Made with high-quality ingredients, our bread has a soft and chewy texture with a hint of sweetness. Perfect for sandwiches, toasting, or enjoying on its own, Pepperidge Farm Bread is a favorite among those who appreciate the taste of handmade, traditional bread. Whether you're looking for a tasty addition to your meal or a delicious snack, our Pepperidge Farm Bread is sure to satisfy your cravings.",$3.20,145,Vegan,Non-Gluten-Free
35,Oroweat Bread,Bakery - Bread,"Oroweat Bread is a premium bakery bread made with high-quality ingredients and a time-tested recipe. With a soft and fluffy texture, this delicious bread is perfect for making sandwiches, toasting with butter, or serving with a hearty bowl of soup. Made with care by expert bakers, Oroweat Bread is the ideal choice for those who appreciate exceptional taste and quality in their bread.",$4.06,538,Vegan,Non-Gluten-Free
36,Arnold Bread,Bakery - Bread,"Arnold Bread is a delectable selection of artisanal breads made from the finest ingredients. Handcrafted with care and precision, each loaf is baked to perfection, boasting a golden crust and a soft, fluffy interior. From classic white and whole wheat to savory sourdough and hearty multigrain, Arnold Bread offers a variety of mouthwatering options to satisfy every craving. Taste the tradition and quality in every slice of Arnold Bread.",$4.18,216,Vegan,Gluten-Free
37,Aunt Millie's Bread,Bakery - Bread,"Aunt Millie's Bread is a classic and comforting choice for any meal. Made with high-quality ingredients and a secret family recipe, each loaf is baked to perfection, with a soft and fluffy texture and a delicious, slightly sweet flavor. Whether you're making sandwiches, toast, or simply enjoying a slice with butter, Aunt Millie's Bread is sure to satisfy and delight your taste buds.",$3.04,709,Vegan,Non-Gluten-Free
38,Sunbeam Bread,Bakery - Bread,"Sunbeam Bread is a delightful and fluffy loaf of bread that is perfect for sandwiches, toast, or simply enjoying on its own. With a golden-brown crust and a soft, white interior, this bread is a staple for any kitchen. Its light and airy texture makes it a favorite among customers of all ages, and its delicious flavor ensures that every slice is savored to the very last bite. Whether you use it to make a classic PB&J or pair it with your favorite soup, Sunbeam Bread is sure to brighten your day.",$3.33,160,Non-Vegan,Non-Gluten-Free
39,Bimbo Bread,Bakery - Bread,"Bimbo Bread is a classic bakery favorite, known for its soft and fluffy texture, and deliciously fresh taste. Baked to perfection, this bread is perfect for sandwiches, toast, or simply enjoyed on its own. Made with high-quality ingredients, Bimbo Bread is a versatile and satisfying choice for any meal or snack.",$1.83,424,Vegan,Non-Gluten-Free
40,Croissants,Bakery - Pastries,"Flaky, buttery, and delicious, our croissants are a classic French pastry that is perfect for any time of day. Whether you're enjoying it for breakfast with a cup of coffee or as a snack with a filling of your choice, our croissants are sure to satisfy your cravings. Made with high-quality ingredients and baked to perfection, our croissants are a must-try for any pastry lover.",$3.06,925,Non-Vegan,Gluten-Free
41,Danish pastries,Bakery - Pastries,"Our delicious Danish pastries are a buttery and flaky treat that will delight your taste buds. These traditional pastries are filled with sweet fruit or rich cheese, and drizzled with a sweet icing. Perfect for enjoying with a cup of coffee or as a decadent dessert. Treat yourself to a taste of Denmark with our irresistible Danish pastries.",$4.72,144,Non-Vegan,Gluten-Free
42,Turnovers,Bakery - Pastries,"""Turnovers are a delightful and delicious pastry product offered by our bakery. These flaky and buttery pastries are filled with a variety of sweet and savory fillings, such as fruit, cheese, or meat. Perfect for breakfast, a snack, or dessert, our turnovers are a must-try treat for any pastry lover.""",$4.28,503,Vegan,Non-Gluten-Free
43,Scones,Bakery - Pastries,"Scones are freshly baked, flaky pastries that are perfect for breakfast or a midday snack. These delicious treats come in a variety of flavors, including classic plain, blueberry, and cranberry orange. Enjoy them with a cup of hot tea or coffee for a delightful and satisfying treat.",$3.06,491,Vegan,Non-Gluten-Free
44,Eclairs,Bakery - Pastries,"Eclairs are a classic French pastry featuring a light, crispy choux dough filled with decadent vanilla or chocolate custard and topped with a rich chocolate glaze. These indulgent treats are perfect for satisfying sweet cravings and are a popular choice for dessert or a special treat with coffee or tea. Our bakery takes pride in creating these delicious eclairs using the highest quality ingredients for a truly delightful pastry experience.",$3.16,468,Non-Vegan,Non-Gluten-Free
45,Cannoli,Bakery - Pastries,"Cannoli are a traditional Italian pastry made of fried pastry dough filled with a sweet, creamy ricotta cheese filling. Our cannoli are freshly made and filled to order, ensuring a crisp shell and decadent, smooth filling every time. Perfect as a standalone treat or as a delightful addition to any dessert spread.",$2.09,179,Non-Vegan,Non-Gluten-Free
46,Palmier cookies,Bakery - Pastries,"Palmier cookies are delicate, flaky pastries made from puff pastry and sweetened with a caramelized sugar coating. These traditional French treats, also known as Elephant Ears, are perfect for a light and crispy snack with a touch of sweetness. Enjoyed by all ages, Palmier cookies are a delightful addition to any dessert table or afternoon tea.",$3.40,170,Vegan,Gluten-Free
47,Bear claws,Bakery - Pastries,"Bear claws are a delectable pastry treat from our bakery. These large, flaky pastries are filled with a sweet almond paste and topped with sliced almonds, resembling the shape of a bear claw. They are perfect for breakfast, a midday snack, or dessert. Each bite offers a satisfying crunch and a burst of nutty, sweet flavor. Each bear claw is freshly baked and guaranteed to leave you craving for more.",$2.94,368,Vegan,Gluten-Free
48,Rugelach,Bakery - Pastries,"Rugelach is a traditional Jewish pastry made with a flaky, buttery dough and filled with sweet fillings such as cinnamon, nuts, and fruit preserves. These crescent-shaped treats are a popular favorite for their delicious combination of crunchy, sweet, and and mouthwatering flavors. Enjoyed as a delectable teatime snack or a delightful dessert, Rugelach is a beloved pastry that's perfect for any occasion.",$3.79,558,Non-Vegan,Gluten-Free
49,Cream puffs,Bakery - Pastries,"Indulge in the light and airy delight of our Cream Puffs. Made with delicate choux pastry and filled with luscious cream, these pastries are the perfect treat for any occasion. Whether you're enjoying one with a cup of coffee in the morning or serving them at a special event, our Cream Puffs are sure to impress with their decadent taste and beautiful presentation.",$1.46,363,Non-Vegan,Non-Gluten-Free
50,Betty Crocker Super Moist Chocolate Fudge Cake Mix,Bakery - Cakes,"Indulge in the rich and decadent flavor of Betty Crocker Super Moist Chocolate Fudge Cake Mix. This convenient cake mix allows you to effortlessly create a moist and luscious chocolate fudge cake at home. With its easy-to-follow instructions and delicious results, this cake mix is perfect for satisfying your sweet tooth and impressing guests at any gathering. Enjoy the irresistible taste of homemade chocolate fudge cake with Betty Crocker's signature quality and convenience.",$2.37,641,Non-Vegan,Gluten-Free
51,Sara Lee All Butter Pound Cake,Bakery - Cakes,"Indulge in the rich, buttery flavor of Sara Lee All Butter Pound Cake. Baked to perfection with only the finest ingredients, this classic pound cake is moist, dense, and irresistible. Enjoy it on its own, topped with fresh fruit, or as a delicious base for your favorite desserts. Perfect for any occasion, this timeless treat is sure to satisfy your sweet cravings.",$1.37,197,Non-Vegan,Gluten-Free
52,Entenmann's Ultimate Crumb Cake,Bakery - Cakes,"Entenmann's Ultimate Crumb Cake is a delectable treat from our bakery that is sure to satisfy any sweet tooth. This cake features a moist, buttery base and is generously topped with a deliciously rich crumb topping. It is the perfect combination of soft and crunchy, making it a delightful addition to any dessert spread or a tasty treat for any time of day. Enjoy this classic bakery favorite with a cup of coffee or milk for a truly indulgent experience.",$1.44,804,Non-Vegan,Gluten-Free
53,Duncan Hines Signature Perfectly Moist Triple Chocolate Cake Mix,Bakery - Cakes,"Indulge in the ultimate chocolate lover's dream with Duncan Hines Signature Perfectly Moist Triple Chocolate Cake Mix. This decadent cake mix combines rich cocoa, velvety chocolate chips, and creamy chocolate frosting for a triple dose of chocolate in every bite. Baked to perfection, this moist and luscious cake is guaranteed to satisfy your sweet tooth and impress your guests. Perfect for any celebration or simply a delightful treat, this cake mix makes it easy to enjoy a gourmet-quality dessert at home.",$4.46,488,Non-Vegan,Non-Gluten-Free
